{
  "record_type": "zygor_npcdata_map_area_bindings",
  "schema_version": "1.0",
  "client_build": "2.4.3.8606",
  "provenance": "librover_static_map_table_reviewed",
  "map_areas": [
    {"map_id": 339, "map_name": "Black Temple"},
    {"map_id": 1411, "map_name": "Durotar"},
    {"map_id": 1412, "map_name": "Mulgore"},
    {"map_id": 1413, "map_name": "The Barrens"},
    {"map_id": 1416, "map_name": "Alterac Mountains"},
    {"map_id": 1417, "map_name": "Arathi Highlands"},
    {"map_id": 1418, "map_name": "Badlands"},
    {"map_id": 1419, "map_name": "Blasted Lands"},
    {"map_id": 1420, "map_name": "Tirisfal Glades"},
    {"map_id": 1421, "map_name": "Silverpine Forest"},
    {"map_id": 1422, "map_name": "Western Plaguelands"},
    {"map_id": 1423, "map_name": "Eastern Plaguelands"},
    {"map_id": 1424, "map_name": "Hillsbrad Foothills"},
    {"map_id": 1425, "map_name": "The Hinterlands"},
    {"map_id": 1426, "map_name": "Dun Morogh"},
    {"map_id": 1427, "map_name": "Searing Gorge"},
    {"map_id": 1428, "map_name": "Burning Steppes"},
    {"map_id": 1429, "map_name": "Elwynn Forest"},
    {"map_id": 1430, "map_name": "Deadwind Pass"},
    {"map_id": 1431, "map_name": "Duskwood"},
    {"map_id": 1432, "map_name": "Loch Modan"},
    {"map_id": 1433, "map_name": "Redridge Mountains"},
    {"map_id": 1434, "map_name": "Stranglethorn Vale"},
    {"map_id": 1435, "map_name": "Swamp of Sorrows"},
    {"map_id": 1436, "map_name": "Westfall"},
    {"map_id": 1437, "map_name": "Wetlands"},
    {"map_id": 1438, "map_name": "Teldrassil"},
    {"map_id": 1439, "map_name": "Darkshore"},
    {"map_id": 1440, "map_name": "Ashenvale"},
    {"map_id": 1441, "map_name": "Thousand Needles"},
    {"map_id": 1442, "map_name": "Stonetalon Mountains"},
    {"map_id": 1443, "map_name": "Desolace"},
    {"map_id": 1444, "map_name": "Feralas"},
    {"map_id": 1445, "map_name": "Dustwallow Marsh"},
    {"map_id": 1446, "map_name": "Tanaris"},
    {"map_id": 1447, "map_name": "Azshara"},
    {"map_id": 1448, "map_name": "Felwood"},
    {"map_id": 1449, "map_name": "Un'Goro Crater"},
    {"map_id": 1450, "map_name": "Moonglade"},
    {"map_id": 1451, "map_name": "Silithus"},
    {"map_id": 1452, "map_name": "Winterspring"},
    {"map_id": 1453, "map_name": "Stormwind City"},
    {"map_id": 1454, "map_name": "Orgrimmar"},
    {"map_id": 1455, "map_name": "Ironforge"},
    {"map_id": 1456, "map_name": "Thunder Bluff"},
    {"map_id": 1457, "map_name": "Darnassus"},
    {"map_id": 1458, "map_name": "Undercity"},
    {"map_id": 1459, "map_name": "Alterac Valley"},
    {"map_id": 1941, "map_name": "Eversong Woods"},
    {"map_id": 1942, "map_name": "Ghostlands"},
    {"map_id": 1943, "map_name": "Azuremyst Isle"},
    {"map_id": 1944, "map_name": "Hellfire Peninsula"},
    {"map_id": 1946, "map_name": "Zangarmarsh"},
    {"map_id": 1947, "map_name": "The Exodar"},
    {"map_id": 1948, "map_name": "Shadowmoon Valley"},
    {"map_id": 1949, "map_name": "Blade's Edge Mountains"},
    {"map_id": 1950, "map_name": "Bloodmyst Isle"},
    {"map_id": 1951, "map_name": "Nagrand"},
    {"map_id": 1952, "map_name": "Terokkar Forest"},
    {"map_id": 1953, "map_name": "Netherstorm"},
    {"map_id": 1954, "map_name": "Silvermoon City"},
    {"map_id": 1955, "map_name": "Shattrath City"},
    {"map_id": 1957, "map_name": "Isle of Quel'Danas"},
    {"map_id": 9002, "map_name": "Blackrock Depths"},
    {"map_id": 9005, "map_name": "Dire Maul"},
    {"map_id": 9006, "map_name": "Gnomeregan"}
  ],
  "execution_authority": false
}
